{
  "spec_version": "v1.0",
  "findings_id": "c3d4e5f6-7890-abcd-ef12-34567890abcd",
  "timestamp": "2024-01-15T10:35:00Z",
  "source": {
    "check_name": "sdp-doc-sync",
    "workflow": "CI",
    "run_id": 1234567890,
    "run_number": 42,
    "repository": "fall-out-bug/sdp_lab",
    "branch": "feature/F077-findings-schema",
    "commit_sha": "abc123def456789012345678901234abcd"
  },
  "configuration": {
    "check_links": true,
    "strict_mode": false,
    "changelog_mode": true
  },
  "findings": [
    {
      "finding_key": "e5f67890abcdef12",
      "severity": "error",
      "category": "broken_link",
      "code": "LINK_404",
      "file": "docs/protocol/CONTRACTS.md",
      "line": 45,
      "column": 1,
      "message": "Link to './schema/contracts/old.schema.json' does not exist",
      "remediation": {
        "hint": "Update link to point to correct schema file",
        "action": "update",
        "suggested_fix": "../../schema/contracts/runtime-decision.schema.json",
        "doc_url": "https://sdp.dev/docs/links"
      },
      "context": {
        "link_target": "./schema/contracts/old.schema.json",
        "link_text": "old schema",
        "section": "Contract Schemas"
      }
    },
    {
      "finding_key": "f67890abcdef1234",
      "severity": "warning",
      "category": "changelog",
      "code": "MISSING_CHANGELOG_ENTRY",
      "file": "docs/CHANGELOG.md",
      "line": 1,
      "message": "No changelog entry for commit abc123 on feature branch",
      "remediation": {
        "hint": "Add changelog entry following Keep a Changelog format",
        "action": "add",
        "template": "### Added\n- F077: Findings schema for CI artifacts\n"
      }
    },
    {
      "finding_key": "7890abcdef123456",
      "severity": "warning",
      "category": "broken_link",
      "code": "BROKEN_ANCHOR",
      "file": "docs/protocol/FINDINGS_SCHEMA.md",
      "line": 120,
      "column": 5,
      "message": "Anchor #versioning-strategy does not exist in target file",
      "remediation": {
        "hint": "Fix anchor name or update target section",
        "action": "fix"
      },
      "context": {
        "link_target": "./CONTRACTS.md#versioning-strategy",
        "link_text": "versioning strategy",
        "expected": "#versioning-strategy",
        "actual": "#versioning"
      }
    },
    {
      "finding_key": "890abcdef1234567",
      "severity": "info",
      "category": "consistency",
      "code": "OUTDATED_INDEX",
      "file": "docs/workstreams/INDEX.md",
      "line": 42,
      "message": "INDEX.md entry for 00-077-01 is outdated (status: backlog, actual: done)",
      "remediation": {
        "hint": "Update INDEX.md to reflect current workstream status",
        "action": "update"
      },
      "context": {
        "expected": "status: done",
        "actual": "status: backlog",
        "related_files": ["docs/workstreams/backlog/00-077-01.md"]
      }
    }
  ],
  "summary": {
    "total": 4,
    "by_severity": {
      "error": 1,
      "warning": 2,
      "info": 1,
      "hint": 0
    },
    "by_category": {
      "broken_link": 2,
      "changelog": 1,
      "consistency": 1
    },
    "links_checked": 156,
    "files_checked": 42
  }
}
